{
  "name": "filesystem",
  "title": "Filesystem",
  "entrypoint": "TOOL.md",
  "description": "Read/write project files inside an approved workspace only.",
  "riskLevel": "low",
  "allowedByDefault": true,
  "requiresApprovalFor": [
    "write actions",
    "destructive actions",
    "external data transfer",
    "cost-incurring actions"
  ]
}