{
  "name": "secrets",
  "title": "Secrets",
  "entrypoint": "TOOL.md",
  "description": "Read secret metadata only; never print secret values.",
  "riskLevel": "high",
  "allowedByDefault": false,
  "requiresApprovalFor": [
    "write actions",
    "destructive actions",
    "external data transfer",
    "cost-incurring actions"
  ]
}