{
  "name": "git",
  "title": "Git",
  "entrypoint": "TOOL.md",
  "description": "Inspect diffs, branches, commits, and status without destructive operations by default.",
  "riskLevel": "low",
  "allowedByDefault": true,
  "requiresApprovalFor": [
    "write actions",
    "destructive actions",
    "external data transfer",
    "cost-incurring actions"
  ]
}