{
  "name": "docker",
  "title": "Docker",
  "entrypoint": "TOOL.md",
  "description": "Build and run isolated services with explicit ports and cleanup.",
  "riskLevel": "high",
  "allowedByDefault": false,
  "requiresApprovalFor": [
    "write actions",
    "destructive actions",
    "external data transfer",
    "cost-incurring actions"
  ]
}