{
  "name": "calendar",
  "title": "Calendar",
  "entrypoint": "TOOL.md",
  "description": "Search and modify events only on explicit user request.",
  "riskLevel": "high",
  "allowedByDefault": false,
  "requiresApprovalFor": [
    "write actions",
    "destructive actions",
    "external data transfer",
    "cost-incurring actions"
  ]
}